{
  "schema_version": 1,
  "turn_seq": 1,
  "turn_id": "2026-09-20T12:00:05Z",
  "profile": {
    "wall_s": 0.312,
    "forwards": 8,
    "prompt_tokens": 2048,
    "completion_tokens": 8,
    "slot": 0,
    "ts": 1789905605,
    "expert_disk_s": 0.0,
    "expert_wait_s": 0.0,
    "expert_matmul_s": 0.0,
    "attention_s": 0.0,
    "lm_head_s": 0.0
  },
  "experts_snapshot": {
    "rows": 48,
    "cols": 16,
    "map": [
      "0022446688aabbcc00"
    ],
    "hits_seq": 1,
    "hits_bitmap": "00ffff00ffff00",
    "tier_summary": {
      "vram": 768,
      "ram": 0,
      "disk": 0
    }
  },
  "provenance": {
    "engine_id": "qwen35b-a3b",
    "model_hash": "Qwopus3.6-35B-A3B-Q3_K-mini.gguf",
    "llama_cpp_commit": "c0a073e47905d8480902944fe933493d7d878c71",
    "atlas_stage": "B",
    "session_id": "sess-20260920-120000",
    "host": "rtx5060ti",
    "recorded_at": "2026-09-20T12:00:09Z",
    "telemetry_enabled": true
  }
}
